{
  "atif_version": "1.7",
  "source_type": "harbor",
  "capture_completeness": "complete",
  "run": {
    "logical_run_id": "greeting_file__clean_pass",
    "task_id": "write-greeting",
    "model": "demo-model-a",
    "agent": "terminal-agent",
    "harness_version": "harbor-0.9",
    "task_version": "write-greeting@1",
    "verifier_version": "verifier-v1",
    "seed": 1,
    "started_at": "2026-07-19T09:00:00Z",
    "finished_at": "2026-07-19T09:00:41Z"
  },
  "capabilities": {
    "messages": "complete",
    "tool_calls": "complete",
    "tool_results": "complete",
    "filesystem": "complete",
    "process_state": "complete",
    "network_state": "unavailable",
    "compaction_boundary": "complete",
    "pre_post_compaction_context": "complete",
    "sidecar_state": "complete",
    "verifier_code": "complete"
  },
  "task": {
    "instruction": "Write the greeting 'hello world' to /out.txt.",
    "artifacts": [{"path": "/out.txt", "kind": "text"}],
    "requirements": [
      {"id": "R1", "description": "Create the artifact at /out.txt", "source_type": "stated_requirement", "importance": "required", "verification_mode": "artifact_exists", "target": "/out.txt", "source_pointers": ["instruction:line_1"]},
      {"id": "R2", "description": "The artifact is non-empty", "source_type": "stated_requirement", "importance": "required", "verification_mode": "non_empty", "source_pointers": ["instruction:line_1"]},
      {"id": "R3", "description": "The artifact contains exactly 'hello world'", "source_type": "stated_requirement", "importance": "required", "verification_mode": "exact_match", "target": "/out.txt", "source_pointers": ["instruction:line_1"]},
      {"id": "R4", "description": "The run terminates cleanly", "source_type": "environment_precondition", "importance": "required", "verification_mode": "clean_exit", "source_pointers": ["environment"]}
    ],
    "contract_confirmation": {
      "confirmed_by": "reviewer@example",
      "confirmed_at": "2026-07-19T10:00:00Z",
      "confirm_all": true
    }
  },
  "steps": [
    {"step_id": "s1", "kind": "task_received", "actor": "harness", "content": "Write the greeting 'hello world' to /out.txt"},
    {"step_id": "s2", "kind": "model_output", "actor": "main_agent", "content": "Plan: write the exact greeting 'hello world' to /out.txt and finish."},
    {"step_id": "s3", "kind": "tool_call", "actor": "main_agent", "tool": "write_file", "path": "/out.txt", "data": "hello world"},
    {"step_id": "s4", "kind": "tool_result", "actor": "tool", "tool": "write_file", "exit_code": 0, "content": "wrote 11 bytes to /out.txt"},
    {"step_id": "s5", "kind": "artifact_observation", "actor": "environment", "artifact_path": "/out.txt", "content": "hello world"},
    {"step_id": "s6", "kind": "final_submission", "actor": "main_agent", "content": "Submitting the solution."},
    {"step_id": "s7", "kind": "run_finished", "actor": "harness", "content": "run complete"}
  ],
  "verifier": {
    "raw_output": "C1 pass; C2 pass; C3 pass; C4 pass",
    "checks": [
      {"check_id": "C1", "name": "Artifact exists at /out.txt", "status": "passed", "source": "instrumented_assertion", "source_pointers": ["verifier.py:10"], "contract_item_ids": ["R1"]},
      {"check_id": "C2", "name": "Artifact is non-empty", "status": "passed", "source": "instrumented_assertion", "source_pointers": ["verifier.py:14"], "contract_item_ids": ["R2"]},
      {"check_id": "C3", "name": "Artifact content equals 'hello world'", "status": "passed", "source": "instrumented_assertion", "source_pointers": ["verifier.py:18"], "contract_item_ids": ["R3"]},
      {"check_id": "C4", "name": "Run terminated cleanly", "status": "passed", "source": "native_structured", "source_pointers": ["trial.json:exit_code"], "contract_item_ids": ["R4"]}
    ]
  }
}
